<Defs xmlns:xsi="http://www.w3.org/2001/XMLSchema-instance" xsi:noNamespaceSchemaLocation="../../../Schemas/ThoughtDef.xsd">
	<ThoughtDef Abstract="true" Name="MergedPawnPersistentBase">
		<workerClass>Pawnmorph.Thoughts.Worker_MergedPawn</workerClass>
	</ThoughtDef>

	<ThoughtDef ParentName="MergedPawnPersistentBase">
		<defName>MergedPawnPersistentThoughtDefault</defName>
		<nullifyingTraits>
			<li>BodyPurist</li>
			<li>MutationAffinity</li>
		</nullifyingTraits>
		<stages>
			<li>
				<label>changed</label>
				<description>What on earth?! I can hear you...me...us? I need some space.</description>
				<baseMoodEffect>-5</baseMoodEffect>
			</li>
			<li>
				<label>lingering instinct</label>
				<description>You, stop thinking about it or we're both going to be in trouble.</description>
				<baseMoodEffect>-3</baseMoodEffect>
			</li>
			<li>
				<label>conflicted minds</label>
				<description>C'mon, stop acting like this...I can't think clearly.</description>
				<baseMoodEffect>-1</baseMoodEffect>
			</li>
			<li>
				<label>hard to think...</label>
				<description>You're...making this worse for both of us...we...I need to sleep.</description>
			</li>
			<li>
				<label>feral animal</label>
				<description>...food?</description>
				<baseMoodEffect>5</baseMoodEffect>
			</li>
			<li>
				<label>...</label>
				<description>Food!</description>
			</li>
		</stages>
		<modExtensions>
			<li Class="Pawnmorph.DefExtensions.AspectRestriction">
				<invert>true</invert>
				<aspectEntries>
					<li>
						<aspectDef>PrimalWish</aspectDef>
					</li>
				</aspectEntries>
			</li>
		</modExtensions>
	</ThoughtDef>

	<ThoughtDef ParentName="MergedPawnPersistentBase">
		<defName>MergedPawnPersistentThoughtMA</defName> <!-- mutation affinity -->
		<requiredTraits>
			<li>MutationAffinity</li>
		</requiredTraits>
		<stages>
			<li>
				<label>changed</label>
				<description>Hey friend, I don't know how you feel about this but I think it's pretty cool.</description>
				<baseMoodEffect>1</baseMoodEffect>
			</li>
			<li>
				<label>lingering instinct</label>
				<description>Hmm...we could get used to this. What, you don't like that 'we'?</description>
				<baseMoodEffect>2</baseMoodEffect>
			</li>
			<li>
				<label>conflicted minds</label>
				<description>Listen to the call of the wild...you'll feel better about this.</description>
				<baseMoodEffect>4</baseMoodEffect>
			</li>
			<li>
				<label>hard to think...</label>
				<description>My other mind wants to stay focused...but I want to enjoy the instinct...just become 'I'.</description>
				<baseMoodEffect>6</baseMoodEffect>
			</li>
			<li>
				<label>feral animal</label>
				<description>...food?</description>
			</li>
			<li>
				<label>...</label>
				<description>Food!</description>
			</li>
		</stages>
		<modExtensions>
			<li Class="Pawnmorph.DefExtensions.AspectRestriction">
				<invert>true</invert>
				<aspectEntries>
					<li>
						<aspectDef>PrimalWish</aspectDef>
					</li>
				</aspectEntries>
			</li>
		</modExtensions>
	</ThoughtDef>

	<ThoughtDef ParentName="MergedPawnPersistentBase">
		<defName>MergedPawnPersistentThoughtBP</defName> <!-- body purist-->
		<requiredTraits>
			<li>BodyPurist</li>
		</requiredTraits>
		<stages>
			<li>
				<label>changed</label>
				<description>This is the worst thing I can imagine, welded to someone else in a freakish body!</description>
				<baseMoodEffect>-30</baseMoodEffect>
			</li>
			<li>
				<label>lingering instinct</label>
				<description>Don't think about it! You're making me feel worse!</description>
				<baseMoodEffect>-20</baseMoodEffect>
			</li>
			<li>
				<label>conflicted mind</label>
				<description>My other mind...wants to give in...but I can't!</description>
				<baseMoodEffect>-15</baseMoodEffect>
			</li>
			<li>
				<label>hard to think...</label>
				<description>Gotta...keep...going...but...can't...</description>
				<baseMoodEffect>-5</baseMoodEffect>
			</li>
			<li>
				<label>feral animal</label>
				<description>...food?</description>
			</li>
			<li>
				<label>...</label>
				<description>Food!</description>
			</li>
		</stages>
	</ThoughtDef>

	<ThoughtDef ParentName="MergedPawnPersistentBase">
		<defName>MergedPawnPersistentThoughtPW</defName> <!-- primal wish -->
		<stages>
			<li>
				<label>primal wish fulfilled</label>
				<description>This is...amazing. Hey, second-head, want to be friends?</description>
				<baseMoodEffect>10</baseMoodEffect>
			</li>
			<li>
				<label>lingering instinct</label>
				<description>We're enjoying this feeling...or at least, I think second-head is.</description>
				<baseMoodEffect>15</baseMoodEffect>
			</li>
			<li>
				<label>conflicted minds</label>
				<description>I'm confused, is it 'we' or 'I'? I could use either...</description>
				<baseMoodEffect>10</baseMoodEffect>
			</li>
			<li>
				<label>hard to think...</label>
				<description>Might...just...give...in...sorry other-head.</description>
				<baseMoodEffect>5</baseMoodEffect>
			</li>
			<li>
				<label>feral animal</label>
				<description>...food?</description>
			</li>
			<li>
				<label>...</label>
				<description>Food!</description>
			</li>
		</stages>
		<modExtensions>
			<li Class="Pawnmorph.DefExtensions.AspectRestriction">
				<aspectEntries>
					<li>
						<aspectDef>PrimalWish</aspectDef>
					</li>
				</aspectEntries>
			</li>
		</modExtensions>
	</ThoughtDef>
</Defs>
