<Defs xmlns:xsi="http://www.w3.org/2001/XMLSchema-instance" xsi:noNamespaceSchemaLocation="../../../../../../../../../Schemas/ThoughtDef.xsd">
    <ThoughtDef ParentName="OutlookMemoryBase">
		<defName>LynxTransformationMemory</defName>
        <stages>
            <li>
                <label>changed</label>
                <description>I'm a... cat? What.</description>
                <baseMoodEffect>-3</baseMoodEffect>
            </li>
            <li>
                <label>changed</label>
                <description>I'm not just a regular cat, I'm a cool-looking lynx!</description>
                <baseMoodEffect>+3</baseMoodEffect>
            </li>
            <li>
                <label>changed</label>
                <description>Ugh! Hairball! Disgusting!</description>
                <baseMoodEffect>-5</baseMoodEffect>
            </li>
            <li>
                <label>changed</label>
                <description>I think I want to go out and hunt mice.</description>
                <baseMoodEffect>+1</baseMoodEffect>
            </li>
        </stages>
    </ThoughtDef>

    <ThoughtDef ParentName="OutlookMemoryBase">
		<defName>LynxRevertedMemory</defName>
        <stages>
            <li>
                <label>reverted</label>
                <description>That fur was getting stuffy... and I shed too much.</description>
                <baseMoodEffect>3</baseMoodEffect>
            </li>
            <li>
                <label>reverted</label>
                <description>But I looked so cool!</description>
                <baseMoodEffect>-3</baseMoodEffect>
            </li>
            <li>
                <label>reverted</label>
                <description>No more hairballs! Thank goodness!</description>
                <baseMoodEffect>10</baseMoodEffect>
            </li>
            <li>
                <label>reverted</label>
                <description>This isn't what I wanted.</description>
                <baseMoodEffect>-5</baseMoodEffect>
            </li>
        </stages>
    </ThoughtDef>
	
</Defs>
