<Defs xmlns:xsi="http://www.w3.org/2001/XMLSchema-instance" xsi:noNamespaceSchemaLocation="../../Schemas/ThoughtDef.xsd">
	<ThoughtDef>
		<defName>ProductiveBliss</defName>
		<durationDays>0.2</durationDays>
		<stages>
			<li>
				<label>productive bliss</label>
				<description>Can't think...feeling so good...</description>
				<baseMoodEffect>+50</baseMoodEffect>
			</li>
		</stages>
	</ThoughtDef>

	<!--Egglayer-->
	<ThoughtDef>
		<defName>LaidEgg</defName>
		<durationDays>0.2</durationDays>
		<stages>
			<li>
				<label>laid an egg</label>
				<description>This is humiliating...and it doesn't feel like it'll be the last.</description>
				<baseMoodEffect>-10</baseMoodEffect>
			</li>
		</stages>
	</ThoughtDef>

	<ThoughtDef>
		<defName>LaidEggMale</defName>
		<durationDays>0.2</durationDays>
		<stages>
			<li>
				<label>laid an egg</label>
				<description>This is humiliating...how does this even work?</description>
				<baseMoodEffect>-20</baseMoodEffect>
			</li>
		</stages>
	</ThoughtDef>

	<ThoughtDef>
		<defName>LaidEggBond</defName>
		<durationDays>0.2</durationDays>
		<stages>
			<li>
				<label>laid an egg</label>
				<description>Egg...! Bok bwark!</description>
				<baseMoodEffect>+10</baseMoodEffect>
			</li>
		</stages>
	</ThoughtDef>

	<ThoughtDef>
		<defName>LaidEggBroken</defName>
		<durationDays>0.2</durationDays>
		<stages>
			<li>
				<label>laid an egg</label>
				<description>B..bok...egg...gh..bwark...</description>
				<baseMoodEffect>-1</baseMoodEffect>
			</li>
		</stages>
	</ThoughtDef>

	<!--Udder-->
	<ThoughtDef>
		<defName>MilkedMyself</defName>
		<durationDays>1</durationDays>
		<stages>
			<li>
				<label>milked myself</label>
				<description>I'm so embarrased.</description>
				<baseMoodEffect>-10</baseMoodEffect>
			</li>
		</stages>
	</ThoughtDef>
	<ThoughtDef>
		<defName>MilkedMyselfMale</defName>
		<durationDays>1</durationDays>
		<stages>
			<li>
				<label>milked myself</label>
				<description>For the love of...not milk!</description>
				<baseMoodEffect>-20</baseMoodEffect>
			</li>
		</stages>
	</ThoughtDef>

	<ThoughtDef>
		<defName>MilkedMyselfBond</defName>
		<durationDays>0.2</durationDays>
		<stages>
			<li>
				<label>milked myself</label>
				<description>Mmmmooooooo!</description>
				<baseMoodEffect>+10</baseMoodEffect>
			</li>
		</stages>
	</ThoughtDef>

	<ThoughtDef>
		<defName>MilkedMyselfBroken</defName>
		<durationDays>0.2</durationDays>
		<stages>
			<li>
				<label>milked myself</label>
				<description>Mm..mooo...mmilk...?</description>
				<baseMoodEffect>-1</baseMoodEffect>
			</li>
		</stages>
	</ThoughtDef>

	<!--Chemical Udder-->
	<ThoughtDef>
		<defName>ChemMilkedMyself</defName>
		<durationDays>1</durationDays>
		<stages>
			<li>
				<label>drained my chemcyst</label>
				<description>This is disgusting.</description>
				<baseMoodEffect>-10</baseMoodEffect>
			</li>
		</stages>
	</ThoughtDef>

	<ThoughtDef>
		<defName>ChemMilkedMyselfBond</defName>
		<durationDays>0.2</durationDays>
		<stages>
			<li>
				<label>drained my chemcyst</label>
				<description>Boom!</description>
				<baseMoodEffect>+10</baseMoodEffect>
			</li>
		</stages>
	</ThoughtDef>

	<ThoughtDef>
		<defName>ChemMilkedMyselfBroken</defName>
		<durationDays>0.2</durationDays>
		<stages>
			<li>
				<label>drained my chemcyst</label>
				<description>B...boom...b..oom?</description>
				<baseMoodEffect>-1</baseMoodEffect>
			</li>
		</stages>
	</ThoughtDef>

	<!--Wooly-->
	<ThoughtDef>
		<defName>ShavedMyself</defName>
		<durationDays>1</durationDays>
		<stages>
			<li>
				<label>shaved myself</label>
				<description>That was a lot of hair. I hope this ends soon.</description>
				<baseMoodEffect>-5</baseMoodEffect>
			</li>
		</stages>
	</ThoughtDef>

	<ThoughtDef>
		<defName>ShavedMyselfBond</defName>
		<durationDays>1</durationDays>
		<stages>
			<li>
				<label>clean shaven</label>
				<description>It's weird, but it feels kinda good to shave all that wool off.</description>
				<baseMoodEffect>5</baseMoodEffect>
			</li>
		</stages>
	</ThoughtDef>

	<ThoughtDef>
		<defName>ShavedMyselfBroken</defName>
		<durationDays>1</durationDays>
		<stages>
			<li>
				<label>shaved myself... again</label>
				<description>This will end, right?</description>
				<baseMoodEffect>-1</baseMoodEffect>
			</li>
		</stages>
	</ThoughtDef>

	<!--Pig/Boar Snout-->
	<ThoughtDef>
		<defName>FoundTruffles</defName>
		<durationDays>0.5</durationDays>
		<stages>
			<li>
				<label>found truffles</label>
				<description>I managed to find some food while sniffing around in the dirt. Kinda dirty, but tasty.</description>
				<baseMoodEffect>5</baseMoodEffect>
			</li>
		</stages>
	</ThoughtDef>
</Defs>
