<Defs xmlns:xsi="http://www.w3.org/2001/XMLSchema-instance" xsi:noNamespaceSchemaLocation="../../../../../../../../../Schemas/ThoughtDef.xsd">

	<ThoughtDef ParentName="OutlookMemoryBase">
        <durationDays>1</durationDays>
        <defName>EtherSnowLeopardJaw</defName>
        <stages>
            <li>
                <label>Snowy face</label>
                <description>It's hard to talk without purring.</description>
                <visible>true</visible>
                <baseMoodEffect>-1</baseMoodEffect>
            </li>
            <li>
                <label>Snowy face</label>
                <description>Mrrow!</description>
                <visible>true</visible>
                <baseMoodEffect>2</baseMoodEffect>
            </li>
            <li>
                <label>Snowy face</label>
                <description>No! I don't want to purr!</description>
                <visible>true</visible>
                <baseMoodEffect>-3</baseMoodEffect>
            </li>
        </stages>
    </ThoughtDef>
	
    <ThoughtDef ParentName="OutlookMemoryBase">
        <durationDays>1</durationDays>
        <defName>EtherSnowLeopardEar</defName>
        <stages>
            <li>
                <label>Snowy ears</label>
                <description>As far as things go, these aren't too bad. They're kinda cute, actually.</description>
                <visible>true</visible>
                <baseMoodEffect>1</baseMoodEffect>
            </li>
            <li>
                <label>Snowy ears</label>
                <description>I can hear everything!</description>
                <visible>true</visible>
                <baseMoodEffect>2</baseMoodEffect>
            </li>
            <li>
                <label>Snowy ears</label>
                <description>I feel like an anime character...</description>
                <visible>true</visible>
                <baseMoodEffect>-2</baseMoodEffect>
            </li>
        </stages>
    </ThoughtDef>
	
    <ThoughtDef ParentName="OutlookMemoryBase">
        <durationDays>1</durationDays>
        <defName>EtherSnowLeopardTail</defName>
        <stages>
            <li>
                <label>Snowy tail</label>
                <description>Sure, it's fluffy and all, but it kind of gets in the way...</description>
                <visible>true</visible>
                <baseMoodEffect>-1</baseMoodEffect>
            </li>
            <li>
                <label>Snowy tail</label>
                <description>So big! So fluffy! I love it!</description>
                <visible>true</visible>
                <baseMoodEffect>1</baseMoodEffect>
            </li>
            <li>
                <label>Snowy tail</label>
                <description>God, this thing is always getting in my way...</description>
                <visible>true</visible>
                <baseMoodEffect>-2</baseMoodEffect>
            </li>
        </stages>
    </ThoughtDef>
	
</Defs>
